{
  "spec": "tcgi.lms.event/1",
  "id": "c1d2e3f4-a5b6-4c7d-8e9f-0a1b2c3d4e10",
  "type": "enrolment.created",
  "schema_version": "1.0",
  "source": "tcgi-lms:staging",
  "idempotency_key": "c1d2e3f4-a5b6-4c7d-8e9f-0a1b2c3d4e10",
  "occurred_at": "2027-02-15T10:00:40Z",
  "effective_at": "2027-02-15T10:00:40Z",
  "aggregate": { "type": "enrolment", "id": "7f000000-0000-4000-8000-000000000001" },
  "source_sequence": 1,
  "data": {
    "enrolment_id": "7f000000-0000-4000-8000-000000000001",
    "person_ref": { "person_id": "3a000000-0000-4000-8000-000000000001" },
    "organisation_ref": "tcgi_direct",
    "course_ref": "SYN-COURSE-FOUNDATION-01",
    "course_revision": 1,
    "access_start": "2027-02-15T10:00:00Z",
    "access_end": "2028-02-15T10:00:00Z",
    "justification_type": "commerce_line"
  }
}
