{
  "spec": "tcgi.lms.event/1",
  "id": "f4a5b6c7-d8e9-4f0a-9b2c-3d4e5f6a7b13",
  "type": "credential.status_changed",
  "schema_version": "1.0",
  "source": "tcgi-lms:staging",
  "idempotency_key": "f4a5b6c7-d8e9-4f0a-9b2c-3d4e5f6a7b13",
  "occurred_at": "2027-04-20T11:05:00Z",
  "effective_at": "2027-04-20T11:05:00Z",
  "aggregate": { "type": "credential", "id": "9c000000-0000-4000-8000-000000000001" },
  "data": {
    "credential_id": "9c000000-0000-4000-8000-000000000001",
    "result_id": "8e000000-0000-4000-8000-000000000001",
    "provider": "accredible",
    "state": "issued",
    "external_url": "https://credentials.sandbox.invalid/c/SYN-1",
    "acknowledged_at": "2027-04-20T11:04:58Z"
  }
}
