{
  "spec": "tcgi.lms.event/1",
  "id": "d2e3f4a5-b6c7-4d8e-9f0a-1b2c3d4e5f11",
  "type": "course.completed",
  "schema_version": "1.0",
  "source": "tcgi-lms:staging",
  "idempotency_key": "d2e3f4a5-b6c7-4d8e-9f0a-1b2c3d4e5f11",
  "occurred_at": "2027-03-01T14:00:00Z",
  "effective_at": "2027-03-01T14:00:00Z",
  "aggregate": { "type": "enrolment", "id": "7f000000-0000-4000-8000-000000000001" },
  "source_sequence": 4,
  "data": {
    "enrolment_id": "7f000000-0000-4000-8000-000000000001",
    "completed_at": "2027-03-01T14:00:00Z",
    "completion_rule_version": "course-rule-PLACEHOLDER-v1"
  }
}
