{
  "spec": "tcgi.lms.event/1",
  "id": "5c3e9b44-2f7a-4a8d-8f0b-7d1a6e3c2b02",
  "type": "entitlement.refunded",
  "schema_version": "1.0",
  "source": "woocommerce:tcgi-store-staging",
  "idempotency_key": "wc-order-SYN1001-line-1-refund-R1",
  "occurred_at": "2027-02-15T10:20:00Z",
  "effective_at": "2027-02-15T10:19:00Z",
  "aggregate": { "type": "commerce_line", "id": "SYN1001:1" },
  "source_sequence": 2,
  "data": {
    "external_order_id": "SYN1001",
    "external_line_id": "1",
    "learner": { "commerce_customer_id": "SYN-C-42", "email": "learner.one@example.test" },
    "product": { "external_product_id": "SYN-PROD-FOUNDATION-01" },
    "action": "revoke",
    "effective_at": "2027-02-15T10:19:00Z",
    "reason_code": "refund_full"
  }
}
